{
  "schema_version": "execution_attempt_wrapper_schema_v1",
  "evaluation_run_id": "llm_judge_v2_full_208__SAMPLE_UCI_POR",
  "record_id": "SAMPLE_UCI_POR__S-T10__baseline_first_20_rows",
  "session_segment_id": "full_208__SAMPLE_UCI_POR__segment_001",
  "session_sequence_number": 93,
  "attempt_number": 1,
  "attempt_reason": "initial",
  "judge_status": "valid",
  "judge_input_sha256": "e071d2327f1cdecfa2e130ca89dd024027f46a15afcf65370a28cd81d6b22974",
  "source_response_id": "manual_raw_output__SAMPLE_UCI_POR__S-T10__baseline_first_20_rows",
  "source_response_message_index": null,
  "source_response_provider_id": null,
  "raw_or_source_response_path": "Docs/evaluation_v2/Runs/full_208/phase13_taskaware_v3_summary/judge_invocation/SAMPLE_UCI_POR/raw_outputs/SAMPLE_UCI_POR__S-T10__baseline_first_20_rows.json",
  "raw_or_source_response_sha256": "f264ceaaeb736e1077b4dd5b5b5cb0cd16fd539095afbfa34ab64cf2528f855e",
  "extracted_output_path": "Docs/evaluation_v2/Runs/full_208/phase13_taskaware_v3_summary/judge_invocation/SAMPLE_UCI_POR/extracted_outputs/SAMPLE_UCI_POR__S-T10__baseline_first_20_rows.json",
  "validated_output_path": "Docs/evaluation_v2/Runs/full_208/phase13_taskaware_v3_summary/judge_invocation/SAMPLE_UCI_POR/validated_outputs/SAMPLE_UCI_POR__S-T10__baseline_first_20_rows.json",
  "validated_output_sha256": "f264ceaaeb736e1077b4dd5b5b5cb0cd16fd539095afbfa34ab64cf2528f855e",
  "validation_errors": [],
  "retrieval_log_path_if_applicable": null,
  "judged_at": "2026-06-20T17:57:22.820Z",
  "validated_at": "2026-06-20T17:57:22.820Z"
}
