{
  "schema_version": "execution_attempt_wrapper_schema_v1",
  "evaluation_run_id": "llm_judge_v3_uci_action_evidence_rerun__SAMPLE_UCI_POR",
  "record_id": "SAMPLE_UCI_POR__A-G11__task_aware_data_summarization",
  "session_segment_id": "phase11_v3_uci_action_evidence_rerun__SAMPLE_UCI_POR__segment_001",
  "session_sequence_number": 42,
  "attempt_number": 1,
  "attempt_reason": "initial",
  "judge_status": "valid",
  "judge_input_sha256": "1d74d71b37abaf30a40793cdf43447b878cf5cac3c23420372d37d17e933b8b1",
  "source_response_id": "manual_raw_output__SAMPLE_UCI_POR__A-G11__task_aware_data_summarization",
  "source_response_message_index": null,
  "source_response_provider_id": null,
  "raw_or_source_response_path": "Docs/evaluation_v2/Runs/full_208/phase11_v3_uci_action_evidence_rerun/judge_invocation/raw_outputs/SAMPLE_UCI_POR__A-G11__task_aware_data_summarization.json",
  "raw_or_source_response_sha256": "46643f38ac9f292192eedcf8756862b6d693f87b3c19401e29b9a0d518f0cfc1",
  "extracted_output_path": "Docs/evaluation_v2/Runs/full_208/phase11_v3_uci_action_evidence_rerun/judge_invocation/extracted_outputs/SAMPLE_UCI_POR__A-G11__task_aware_data_summarization.json",
  "validated_output_path": "Docs/evaluation_v2/Runs/full_208/phase11_v3_uci_action_evidence_rerun/judge_invocation/validated_outputs/SAMPLE_UCI_POR__A-G11__task_aware_data_summarization.json",
  "validated_output_sha256": "46643f38ac9f292192eedcf8756862b6d693f87b3c19401e29b9a0d518f0cfc1",
  "validation_errors": [],
  "retrieval_log_path_if_applicable": null,
  "judged_at": "2026-06-20T02:58:02.812Z",
  "validated_at": "2026-06-20T02:58:02.812Z"
}
