{
  "schema_version": "execution_attempt_wrapper_schema_v1",
  "evaluation_run_id": "llm_judge_v2_phase13_saufix_executable_only__SAMPLE_UCI_POR",
  "record_id": "SAMPLE_UCI_POR__S-B01__task_aware_data_summarization",
  "session_segment_id": "phase13_saufix_executable_only__SAMPLE_UCI_POR__segment_001",
  "session_sequence_number": 28,
  "attempt_number": 1,
  "attempt_reason": "initial",
  "judge_status": "valid",
  "judge_input_sha256": "5cdb57569af2ef5ef23ce8c069f065fe18d5c5cf3dd99dfabe878bb1c6693fb4",
  "source_response_id": "manual_raw_output__SAMPLE_UCI_POR__S-B01__task_aware_data_summarization",
  "source_response_message_index": null,
  "source_response_provider_id": null,
  "raw_or_source_response_path": "Docs/evaluation_v2/Runs/full_208/phase13_taskaware_saufix_executable_only/judge_invocation/SAMPLE_UCI_POR/raw_outputs/SAMPLE_UCI_POR__S-B01__task_aware_data_summarization.json",
  "raw_or_source_response_sha256": "d9318edc496729ec7909dfd43be00bf40227ad678e6b212a67e44a400e8fcdbd",
  "extracted_output_path": "Docs/evaluation_v2/Runs/full_208/phase13_taskaware_saufix_executable_only/judge_invocation/SAMPLE_UCI_POR/extracted_outputs/SAMPLE_UCI_POR__S-B01__task_aware_data_summarization.json",
  "validated_output_path": "Docs/evaluation_v2/Runs/full_208/phase13_taskaware_saufix_executable_only/judge_invocation/SAMPLE_UCI_POR/validated_outputs/SAMPLE_UCI_POR__S-B01__task_aware_data_summarization.json",
  "validated_output_sha256": "d9318edc496729ec7909dfd43be00bf40227ad678e6b212a67e44a400e8fcdbd",
  "validation_errors": [],
  "retrieval_log_path_if_applicable": null,
  "judged_at": "2026-06-21T11:08:24.023Z",
  "validated_at": "2026-06-21T11:08:24.023Z"
}
