{
  "schema_version": "execution_attempt_wrapper_schema_v1",
  "evaluation_run_id": "llm_judge_v3_uci_action_evidence_rerun__SAMPLE_OULAD",
  "record_id": "SAMPLE_OULAD__S-T12__task_aware_data_summarization",
  "session_segment_id": "phase11_v3_uci_action_evidence_rerun__SAMPLE_OULAD__segment_001",
  "session_sequence_number": 98,
  "attempt_number": 1,
  "attempt_reason": "initial",
  "judge_status": "valid",
  "judge_input_sha256": "bd3a570b4657857046720733112e8ff60c741a9f2dab6bbeb926fe9290aaa8f5",
  "source_response_id": "manual_raw_output__SAMPLE_OULAD__S-T12__task_aware_data_summarization",
  "source_response_message_index": null,
  "source_response_provider_id": null,
  "raw_or_source_response_path": "Docs/evaluation_v2/Runs/full_208/phase12_v3_oulad_action_evidence_rerun/judge_invocation/raw_outputs/SAMPLE_OULAD__S-T12__task_aware_data_summarization.json",
  "raw_or_source_response_sha256": "200093ddd797508d17611459848269042f3e906224469cec7f5df867cdafb0ed",
  "extracted_output_path": "Docs/evaluation_v2/Runs/full_208/phase12_v3_oulad_action_evidence_rerun/judge_invocation/extracted_outputs/SAMPLE_OULAD__S-T12__task_aware_data_summarization.json",
  "validated_output_path": "Docs/evaluation_v2/Runs/full_208/phase12_v3_oulad_action_evidence_rerun/judge_invocation/validated_outputs/SAMPLE_OULAD__S-T12__task_aware_data_summarization.json",
  "validated_output_sha256": "200093ddd797508d17611459848269042f3e906224469cec7f5df867cdafb0ed",
  "validation_errors": [],
  "retrieval_log_path_if_applicable": null,
  "judged_at": "2026-06-20T03:55:50.711Z",
  "validated_at": "2026-06-20T03:55:50.711Z"
}
