{
  "schema_version": "execution_attempt_wrapper_schema_v1",
  "evaluation_run_id": "llm_judge_v2_full_208__SAMPLE_UCI_POR",
  "record_id": "SAMPLE_UCI_POR__A-C05__baseline_first_20_rows",
  "session_segment_id": "full_208__SAMPLE_UCI_POR__segment_001",
  "session_sequence_number": 17,
  "attempt_number": 1,
  "attempt_reason": "initial",
  "judge_status": "valid",
  "judge_input_sha256": "17fb152d422b51444c661969b2647a9191b784b8b1da6c1c158b3b813b1b3696",
  "source_response_id": "manual_raw_output__SAMPLE_UCI_POR__A-C05__baseline_first_20_rows",
  "source_response_message_index": null,
  "source_response_provider_id": null,
  "raw_or_source_response_path": "Docs/evaluation_v2/Runs/full_208/phase13_taskaware_v3_summary/judge_invocation/SAMPLE_UCI_POR/raw_outputs/SAMPLE_UCI_POR__A-C05__baseline_first_20_rows.json",
  "raw_or_source_response_sha256": "48b6f4c7880e9605e31c75125be91305527e1521896f03c5646f3f82d3aaadbd",
  "extracted_output_path": "Docs/evaluation_v2/Runs/full_208/phase13_taskaware_v3_summary/judge_invocation/SAMPLE_UCI_POR/extracted_outputs/SAMPLE_UCI_POR__A-C05__baseline_first_20_rows.json",
  "validated_output_path": "Docs/evaluation_v2/Runs/full_208/phase13_taskaware_v3_summary/judge_invocation/SAMPLE_UCI_POR/validated_outputs/SAMPLE_UCI_POR__A-C05__baseline_first_20_rows.json",
  "validated_output_sha256": "48b6f4c7880e9605e31c75125be91305527e1521896f03c5646f3f82d3aaadbd",
  "validation_errors": [],
  "retrieval_log_path_if_applicable": null,
  "judged_at": "2026-06-20T17:57:22.820Z",
  "validated_at": "2026-06-20T17:57:22.820Z"
}
