{
  "schema_version": "execution_attempt_wrapper_schema_v1",
  "evaluation_run_id": "llm_judge_v3_uci_action_evidence_rerun__SAMPLE_UCI_POR",
  "record_id": "SAMPLE_UCI_POR__A-G12__baseline_first_20_rows",
  "session_segment_id": "phase11_v3_uci_action_evidence_rerun__SAMPLE_UCI_POR__segment_001",
  "session_sequence_number": 43,
  "attempt_number": 1,
  "attempt_reason": "initial",
  "judge_status": "valid",
  "judge_input_sha256": "6140b1ce54954df75bb52ac7ae072757565d8790ecae10f62a2ede518d4725c1",
  "source_response_id": "manual_raw_output__SAMPLE_UCI_POR__A-G12__baseline_first_20_rows",
  "source_response_message_index": null,
  "source_response_provider_id": null,
  "raw_or_source_response_path": "Docs/evaluation_v2/Runs/full_208/phase11_v3_uci_action_evidence_rerun/judge_invocation/raw_outputs/SAMPLE_UCI_POR__A-G12__baseline_first_20_rows.json",
  "raw_or_source_response_sha256": "f07a6de3d9d2ed1636fcc5aa0c03189148c3b76a634e9e11ee785e838e9cf895",
  "extracted_output_path": "Docs/evaluation_v2/Runs/full_208/phase11_v3_uci_action_evidence_rerun/judge_invocation/extracted_outputs/SAMPLE_UCI_POR__A-G12__baseline_first_20_rows.json",
  "validated_output_path": "Docs/evaluation_v2/Runs/full_208/phase11_v3_uci_action_evidence_rerun/judge_invocation/validated_outputs/SAMPLE_UCI_POR__A-G12__baseline_first_20_rows.json",
  "validated_output_sha256": "f07a6de3d9d2ed1636fcc5aa0c03189148c3b76a634e9e11ee785e838e9cf895",
  "validation_errors": [],
  "retrieval_log_path_if_applicable": null,
  "judged_at": "2026-06-20T02:58:02.812Z",
  "validated_at": "2026-06-20T02:58:02.812Z"
}
