{
 "schema_version": "execution_attempt_wrapper_schema_v1",
 "evaluation_run_id": "oulad_official_r5",
 "record_id": "SAMPLE_OULAD__A-C06__task_aware_data_summarization",
 "session_segment_id": "oulad_official_r5_segment_001",
 "session_sequence_number": 18,
 "attempt_number": 1,
 "attempt_reason": "initial",
 "judge_status": "valid",
 "judge_input_sha256": "fac0ffbb9fa08f9ac78b0fd3073811fca4ecf6ae7fb5df42c4d4d4a46fb9db4a",
 "source_response_id": "manual_raw_output__SAMPLE_OULAD__A-C06__task_aware_data_summarization",
 "source_response_message_index": null,
 "source_response_provider_id": null,
 "raw_or_source_response_path": "Docs/evaluation_v2/Runs/full_208/phase13_local_taskaware/oulad_official_r5/judge_invocation/raw_outputs/SAMPLE_OULAD__A-C06__task_aware_data_summarization.json",
 "raw_or_source_response_sha256": "015f311ff125de60e6bceac368f4cddc01e3222dc9f282eb51b546b8c65f61b8",
 "extracted_output_path": "Docs/evaluation_v2/Runs/full_208/phase13_local_taskaware/oulad_official_r5/judge_invocation/extracted_outputs/SAMPLE_OULAD__A-C06__task_aware_data_summarization.json",
 "validated_output_path": "Docs/evaluation_v2/Runs/full_208/phase13_local_taskaware/oulad_official_r5/judge_invocation/validated_outputs/SAMPLE_OULAD__A-C06__task_aware_data_summarization.json",
 "validated_output_sha256": "c6c2ccf58fb20c9d6a9fd9510df2b466da85ee32787792a5e4b1c03b85432dfc",
 "validation_errors": [],
 "retrieval_log_path_if_applicable": null,
 "judged_at": "2026-06-21T21:15:09.698Z",
 "validated_at": "2026-06-21T21:15:09.698Z"
}
