{
  "schema_version": "execution_attempt_wrapper_schema_v1",
  "evaluation_run_id": "llm_judge_v2_phase13_saufix_executable_only__SAMPLE_UCI_POR",
  "record_id": "SAMPLE_UCI_POR__S-T14__baseline_first_20_rows",
  "session_segment_id": "phase13_saufix_executable_only__SAMPLE_UCI_POR__segment_001",
  "session_sequence_number": 45,
  "attempt_number": 1,
  "attempt_reason": "initial",
  "judge_status": "valid",
  "judge_input_sha256": "cf6bdd912d27c83a82ce067efb5644938636c0d57abbad47e60a640fb22ef385",
  "source_response_id": "manual_raw_output__SAMPLE_UCI_POR__S-T14__baseline_first_20_rows",
  "source_response_message_index": null,
  "source_response_provider_id": null,
  "raw_or_source_response_path": "Docs/evaluation_v2/Runs/full_208/phase13_taskaware_saufix_executable_only/judge_invocation/SAMPLE_UCI_POR/raw_outputs/SAMPLE_UCI_POR__S-T14__baseline_first_20_rows.json",
  "raw_or_source_response_sha256": "d1bb406c812d608dabe0887647b9a2bd5cb6af58c8e556d6d7a28e067b64b839",
  "extracted_output_path": "Docs/evaluation_v2/Runs/full_208/phase13_taskaware_saufix_executable_only/judge_invocation/SAMPLE_UCI_POR/extracted_outputs/SAMPLE_UCI_POR__S-T14__baseline_first_20_rows.json",
  "validated_output_path": "Docs/evaluation_v2/Runs/full_208/phase13_taskaware_saufix_executable_only/judge_invocation/SAMPLE_UCI_POR/validated_outputs/SAMPLE_UCI_POR__S-T14__baseline_first_20_rows.json",
  "validated_output_sha256": "d1bb406c812d608dabe0887647b9a2bd5cb6af58c8e556d6d7a28e067b64b839",
  "validation_errors": [],
  "retrieval_log_path_if_applicable": "Docs/evaluation_v2/Runs/full_208/phase13_taskaware_saufix_executable_only/judge_inputs/retrieval_logs/SAMPLE_UCI_POR__S-T14__baseline_first_20_rows.json",
  "judged_at": "2026-06-21T11:08:24.023Z",
  "validated_at": "2026-06-21T11:08:24.023Z"
}
