{
  "schema_version": "execution_attempt_wrapper_schema_v1",
  "evaluation_run_id": "llm_judge_v3_uci_rerun__SAMPLE_UCI_POR",
  "record_id": "SAMPLE_UCI_POR__A-G12__task_aware_data_summarization",
  "session_segment_id": "phase10_v3_uci_rerun__SAMPLE_UCI_POR__segment_001",
  "session_sequence_number": 44,
  "attempt_number": 1,
  "attempt_reason": "initial",
  "judge_status": "valid",
  "judge_input_sha256": "fe0fb43b632aa180ad954e871cb79892cc0a8c1acea176a0116455eb131f18eb",
  "source_response_id": "manual_raw_output__SAMPLE_UCI_POR__A-G12__task_aware_data_summarization",
  "source_response_message_index": null,
  "source_response_provider_id": null,
  "raw_or_source_response_path": "Docs/evaluation_v2/Runs/full_208/phase10_v3_uci_rerun/judge_invocation/raw_outputs/SAMPLE_UCI_POR__A-G12__task_aware_data_summarization.json",
  "raw_or_source_response_sha256": "b11afd46d3a1c1939067a91477940864f7c01215e42c007ec8ff176b6dfe3631",
  "extracted_output_path": "Docs/evaluation_v2/Runs/full_208/phase10_v3_uci_rerun/judge_invocation/extracted_outputs/SAMPLE_UCI_POR__A-G12__task_aware_data_summarization.json",
  "validated_output_path": "Docs/evaluation_v2/Runs/full_208/phase10_v3_uci_rerun/judge_invocation/validated_outputs/SAMPLE_UCI_POR__A-G12__task_aware_data_summarization.json",
  "validated_output_sha256": "b11afd46d3a1c1939067a91477940864f7c01215e42c007ec8ff176b6dfe3631",
  "validation_errors": [],
  "retrieval_log_path_if_applicable": null,
  "judged_at": "2026-06-19T12:41:44.837Z",
  "validated_at": "2026-06-19T12:41:44.837Z"
}
