{
  "schema_version": "execution_attempt_wrapper_schema_v1",
  "evaluation_run_id": "llm_judge_v3_uci_rerun__SAMPLE_UCI_POR",
  "record_id": "SAMPLE_UCI_POR__S-T06__task_aware_data_summarization",
  "session_segment_id": "phase10_v3_uci_rerun__SAMPLE_UCI_POR__segment_001",
  "session_sequence_number": 86,
  "attempt_number": 1,
  "attempt_reason": "initial",
  "judge_status": "valid",
  "judge_input_sha256": "690cd7751cfcfc31273d5dddb10b144f461f9c038ff893d30e9657d808c0af96",
  "source_response_id": "manual_raw_output__SAMPLE_UCI_POR__S-T06__task_aware_data_summarization",
  "source_response_message_index": null,
  "source_response_provider_id": null,
  "raw_or_source_response_path": "Docs/evaluation_v2/Runs/full_208/phase10_v3_uci_rerun/judge_invocation/raw_outputs/SAMPLE_UCI_POR__S-T06__task_aware_data_summarization.json",
  "raw_or_source_response_sha256": "e5f1b0c633f5fb8ffc73e7443096070f89663035bd55bb38b18773f1e870b6dc",
  "extracted_output_path": "Docs/evaluation_v2/Runs/full_208/phase10_v3_uci_rerun/judge_invocation/extracted_outputs/SAMPLE_UCI_POR__S-T06__task_aware_data_summarization.json",
  "validated_output_path": "Docs/evaluation_v2/Runs/full_208/phase10_v3_uci_rerun/judge_invocation/validated_outputs/SAMPLE_UCI_POR__S-T06__task_aware_data_summarization.json",
  "validated_output_sha256": "e5f1b0c633f5fb8ffc73e7443096070f89663035bd55bb38b18773f1e870b6dc",
  "validation_errors": [],
  "retrieval_log_path_if_applicable": null,
  "judged_at": "2026-06-19T12:41:44.837Z",
  "validated_at": "2026-06-19T12:41:44.837Z"
}
