{
 "schema_version": "execution_attempt_wrapper_schema_v1",
 "evaluation_run_id": "oulad_official_r5",
 "record_id": "SAMPLE_OULAD__A-G16__task_aware_data_summarization",
 "session_segment_id": "oulad_official_r5_segment_001",
 "session_sequence_number": 48,
 "attempt_number": 1,
 "attempt_reason": "initial",
 "judge_status": "valid",
 "judge_input_sha256": "fae2fa335d7f4c28040eeeb9da58f5cc3348360b532e7526d49f383c872a5927",
 "source_response_id": "manual_raw_output__SAMPLE_OULAD__A-G16__task_aware_data_summarization",
 "source_response_message_index": null,
 "source_response_provider_id": null,
 "raw_or_source_response_path": "Docs/evaluation_v2/Runs/full_208/phase13_local_taskaware/oulad_official_r5/judge_invocation/raw_outputs/SAMPLE_OULAD__A-G16__task_aware_data_summarization.json",
 "raw_or_source_response_sha256": "41b53fb6c832032cc18bf1ebfb1815805561a8a58cd2a8b7f56a2d2225d13502",
 "extracted_output_path": "Docs/evaluation_v2/Runs/full_208/phase13_local_taskaware/oulad_official_r5/judge_invocation/extracted_outputs/SAMPLE_OULAD__A-G16__task_aware_data_summarization.json",
 "validated_output_path": "Docs/evaluation_v2/Runs/full_208/phase13_local_taskaware/oulad_official_r5/judge_invocation/validated_outputs/SAMPLE_OULAD__A-G16__task_aware_data_summarization.json",
 "validated_output_sha256": "ca60ed201f5bbfc4e362c053c4ee33fe0f50bb9a0d109f3f3d19868d77015dfb",
 "validation_errors": [],
 "retrieval_log_path_if_applicable": null,
 "judged_at": "2026-06-21T21:15:09.698Z",
 "validated_at": "2026-06-21T21:15:09.698Z"
}
