{
  "schema_version": "execution_attempt_wrapper_schema_v1",
  "evaluation_run_id": "llm_judge_v3_uci_action_evidence_rerun__SAMPLE_OULAD",
  "record_id": "SAMPLE_OULAD__A-B02__task_aware_data_summarization",
  "session_segment_id": "phase11_v3_uci_action_evidence_rerun__SAMPLE_OULAD__segment_001",
  "session_sequence_number": 4,
  "attempt_number": 1,
  "attempt_reason": "initial",
  "judge_status": "valid",
  "judge_input_sha256": "1aaa37d2ad6160f70d2473a732d523994d395391cd728b7f02c5634898107a88",
  "source_response_id": "manual_raw_output__SAMPLE_OULAD__A-B02__task_aware_data_summarization",
  "source_response_message_index": null,
  "source_response_provider_id": null,
  "raw_or_source_response_path": "Docs/evaluation_v2/Runs/full_208/phase12_v3_oulad_action_evidence_rerun/judge_invocation/raw_outputs/SAMPLE_OULAD__A-B02__task_aware_data_summarization.json",
  "raw_or_source_response_sha256": "ef549a51633ab453cc4f9fec738c7ed6e5105a062dce933e1d9d2d39e2d83fdc",
  "extracted_output_path": "Docs/evaluation_v2/Runs/full_208/phase12_v3_oulad_action_evidence_rerun/judge_invocation/extracted_outputs/SAMPLE_OULAD__A-B02__task_aware_data_summarization.json",
  "validated_output_path": "Docs/evaluation_v2/Runs/full_208/phase12_v3_oulad_action_evidence_rerun/judge_invocation/validated_outputs/SAMPLE_OULAD__A-B02__task_aware_data_summarization.json",
  "validated_output_sha256": "ef549a51633ab453cc4f9fec738c7ed6e5105a062dce933e1d9d2d39e2d83fdc",
  "validation_errors": [],
  "retrieval_log_path_if_applicable": null,
  "judged_at": "2026-06-20T03:55:50.711Z",
  "validated_at": "2026-06-20T03:55:50.711Z"
}
