{
  "schema_version": "execution_attempt_wrapper_schema_v1",
  "evaluation_run_id": "llm_judge_v2_full_208__SAMPLE_UCI_POR",
  "record_id": "SAMPLE_UCI_POR__A-B04__task_aware_data_summarization",
  "session_segment_id": "full_208__SAMPLE_UCI_POR__segment_001",
  "session_sequence_number": 8,
  "attempt_number": 1,
  "attempt_reason": "initial",
  "judge_status": "valid",
  "judge_input_sha256": "c7425c4045e677849914856ee8e8a7039c88d2cbcf6f35d04c529c1e51b51c14",
  "source_response_id": "manual_raw_output__SAMPLE_UCI_POR__A-B04__task_aware_data_summarization",
  "source_response_message_index": null,
  "source_response_provider_id": null,
  "raw_or_source_response_path": "Docs/evaluation_v2/Runs/full_208/phase13_taskaware_v3_summary/judge_invocation/SAMPLE_UCI_POR/raw_outputs/SAMPLE_UCI_POR__A-B04__task_aware_data_summarization.json",
  "raw_or_source_response_sha256": "df3b67426b1ddf64001b0df210bdbab395ff1f89777b6e0f6090d82775378fa6",
  "extracted_output_path": "Docs/evaluation_v2/Runs/full_208/phase13_taskaware_v3_summary/judge_invocation/SAMPLE_UCI_POR/extracted_outputs/SAMPLE_UCI_POR__A-B04__task_aware_data_summarization.json",
  "validated_output_path": "Docs/evaluation_v2/Runs/full_208/phase13_taskaware_v3_summary/judge_invocation/SAMPLE_UCI_POR/validated_outputs/SAMPLE_UCI_POR__A-B04__task_aware_data_summarization.json",
  "validated_output_sha256": "df3b67426b1ddf64001b0df210bdbab395ff1f89777b6e0f6090d82775378fa6",
  "validation_errors": [],
  "retrieval_log_path_if_applicable": null,
  "judged_at": "2026-06-20T17:57:22.820Z",
  "validated_at": "2026-06-20T17:57:22.820Z"
}
