{
  "schema_version": "execution_attempt_wrapper_schema_v1",
  "evaluation_run_id": "llm_judge_v3_uci_rerun__SAMPLE_UCI_POR",
  "record_id": "SAMPLE_UCI_POR__S-T13__baseline_first_20_rows",
  "session_segment_id": "phase10_v3_uci_rerun__SAMPLE_UCI_POR__segment_001",
  "session_sequence_number": 99,
  "attempt_number": 1,
  "attempt_reason": "initial",
  "judge_status": "valid",
  "judge_input_sha256": "91e666af1e03c4cd53e147931cb887dcdcf3ef24183eb5ab37b24e95df7201e1",
  "source_response_id": "manual_raw_output__SAMPLE_UCI_POR__S-T13__baseline_first_20_rows",
  "source_response_message_index": null,
  "source_response_provider_id": null,
  "raw_or_source_response_path": "Docs/evaluation_v2/Runs/full_208/phase10_v3_uci_rerun/judge_invocation/raw_outputs/SAMPLE_UCI_POR__S-T13__baseline_first_20_rows.json",
  "raw_or_source_response_sha256": "169d3bb2559ff73cddf7c6933a2665d98aea2a4cf798ba09cb40db22829fa7b4",
  "extracted_output_path": "Docs/evaluation_v2/Runs/full_208/phase10_v3_uci_rerun/judge_invocation/extracted_outputs/SAMPLE_UCI_POR__S-T13__baseline_first_20_rows.json",
  "validated_output_path": "Docs/evaluation_v2/Runs/full_208/phase10_v3_uci_rerun/judge_invocation/validated_outputs/SAMPLE_UCI_POR__S-T13__baseline_first_20_rows.json",
  "validated_output_sha256": "169d3bb2559ff73cddf7c6933a2665d98aea2a4cf798ba09cb40db22829fa7b4",
  "validation_errors": [],
  "retrieval_log_path_if_applicable": null,
  "judged_at": "2026-06-19T12:41:44.837Z",
  "validated_at": "2026-06-19T12:41:44.837Z"
}
