{
 "schema_version": "execution_attempt_wrapper_schema_v1",
 "evaluation_run_id": "phase13_local_taskaware_official_r4_fresh_judge",
 "record_id": "SAMPLE_UCI_POR__S-T01__baseline_first_20_rows",
 "session_segment_id": "phase13_local_official_r4_fresh_judge_segment_001",
 "session_sequence_number": 31,
 "attempt_number": 1,
 "attempt_reason": "initial",
 "judge_status": "valid",
 "judge_input_sha256": "9a4a649adbe0a4e3df89286f19c0f207741abc31c5135e9c211d05c347a76433",
 "source_response_id": "manual_raw_output__SAMPLE_UCI_POR__S-T01__baseline_first_20_rows",
 "source_response_message_index": null,
 "source_response_provider_id": null,
 "raw_or_source_response_path": "Docs/evaluation_v2/Runs/full_208/phase13_local_taskaware/official_r4_fresh_judge/judge_invocation/raw_outputs/SAMPLE_UCI_POR__S-T01__baseline_first_20_rows.json",
 "raw_or_source_response_sha256": "c475e7021e5249ea90da5a24827255f94a8e646a06bc1c3f733a3635e64f58e0",
 "extracted_output_path": "Docs/evaluation_v2/Runs/full_208/phase13_local_taskaware/official_r4_fresh_judge/judge_invocation/extracted_outputs/SAMPLE_UCI_POR__S-T01__baseline_first_20_rows.json",
 "validated_output_path": "Docs/evaluation_v2/Runs/full_208/phase13_local_taskaware/official_r4_fresh_judge/judge_invocation/validated_outputs/SAMPLE_UCI_POR__S-T01__baseline_first_20_rows.json",
 "validated_output_sha256": "c475e7021e5249ea90da5a24827255f94a8e646a06bc1c3f733a3635e64f58e0",
 "validation_errors": [],
 "retrieval_log_path_if_applicable": null,
 "judged_at": "2026-06-21T13:33:48.172Z",
 "validated_at": "2026-06-21T13:33:48.172Z"
}
