{
  "schema_version": "execution_attempt_wrapper_schema_v1",
  "evaluation_run_id": "llm_judge_v3_uci_action_evidence_rerun__SAMPLE_UCI_POR",
  "record_id": "SAMPLE_UCI_POR__A-G15__baseline_first_20_rows",
  "session_segment_id": "phase11_v3_uci_action_evidence_rerun__SAMPLE_UCI_POR__segment_001",
  "session_sequence_number": 49,
  "attempt_number": 1,
  "attempt_reason": "initial",
  "judge_status": "valid",
  "judge_input_sha256": "6cd95ec65ad55163b17ada8fa1fb653a97514164f02bb6741794f1d867c84a51",
  "source_response_id": "manual_raw_output__SAMPLE_UCI_POR__A-G15__baseline_first_20_rows",
  "source_response_message_index": null,
  "source_response_provider_id": null,
  "raw_or_source_response_path": "Docs/evaluation_v2/Runs/full_208/phase11_v3_uci_action_evidence_rerun/judge_invocation/raw_outputs/SAMPLE_UCI_POR__A-G15__baseline_first_20_rows.json",
  "raw_or_source_response_sha256": "fb892e2d2ecceda9d042695474dbc7e421eee7777c3501ebd5664665fef04dce",
  "extracted_output_path": "Docs/evaluation_v2/Runs/full_208/phase11_v3_uci_action_evidence_rerun/judge_invocation/extracted_outputs/SAMPLE_UCI_POR__A-G15__baseline_first_20_rows.json",
  "validated_output_path": "Docs/evaluation_v2/Runs/full_208/phase11_v3_uci_action_evidence_rerun/judge_invocation/validated_outputs/SAMPLE_UCI_POR__A-G15__baseline_first_20_rows.json",
  "validated_output_sha256": "fb892e2d2ecceda9d042695474dbc7e421eee7777c3501ebd5664665fef04dce",
  "validation_errors": [],
  "retrieval_log_path_if_applicable": null,
  "judged_at": "2026-06-20T02:58:02.812Z",
  "validated_at": "2026-06-20T02:58:02.812Z"
}
