{
  "schema_version": "execution_attempt_wrapper_schema_v1",
  "evaluation_run_id": "llm_judge_v3_uci_action_evidence_rerun__SAMPLE_OULAD",
  "record_id": "SAMPLE_OULAD__A-G14__baseline_first_20_rows",
  "session_segment_id": "phase11_v3_uci_action_evidence_rerun__SAMPLE_OULAD__segment_001",
  "session_sequence_number": 47,
  "attempt_number": 1,
  "attempt_reason": "initial",
  "judge_status": "valid",
  "judge_input_sha256": "3705c4132882f0c8b06d228eeb43ebc37efadbeba4357297effaaa607207faed",
  "source_response_id": "manual_raw_output__SAMPLE_OULAD__A-G14__baseline_first_20_rows",
  "source_response_message_index": null,
  "source_response_provider_id": null,
  "raw_or_source_response_path": "Docs/evaluation_v2/Runs/full_208/phase12_v3_oulad_action_evidence_rerun/judge_invocation/raw_outputs/SAMPLE_OULAD__A-G14__baseline_first_20_rows.json",
  "raw_or_source_response_sha256": "555cb4042ec085d388b702d1dbd47a63ebce8b46b93183b7793b7276c7b5b65d",
  "extracted_output_path": "Docs/evaluation_v2/Runs/full_208/phase12_v3_oulad_action_evidence_rerun/judge_invocation/extracted_outputs/SAMPLE_OULAD__A-G14__baseline_first_20_rows.json",
  "validated_output_path": "Docs/evaluation_v2/Runs/full_208/phase12_v3_oulad_action_evidence_rerun/judge_invocation/validated_outputs/SAMPLE_OULAD__A-G14__baseline_first_20_rows.json",
  "validated_output_sha256": "555cb4042ec085d388b702d1dbd47a63ebce8b46b93183b7793b7276c7b5b65d",
  "validation_errors": [],
  "retrieval_log_path_if_applicable": "Docs/evaluation_v2/Runs/full_208/phase8_judge_inputs/retrieval_logs/SAMPLE_OULAD__A-G14__baseline_first_20_rows.json",
  "judged_at": "2026-06-20T03:55:50.711Z",
  "validated_at": "2026-06-20T03:55:50.711Z"
}
