{
  "schema_version": "execution_attempt_wrapper_schema_v1",
  "evaluation_run_id": "llm_judge_v3_uci_rerun__SAMPLE_UCI_POR",
  "record_id": "SAMPLE_UCI_POR__A-S02__baseline_first_20_rows",
  "session_segment_id": "phase10_v3_uci_rerun__SAMPLE_UCI_POR__segment_001",
  "session_sequence_number": 55,
  "attempt_number": 1,
  "attempt_reason": "initial",
  "judge_status": "valid",
  "judge_input_sha256": "010e3e8676ace438522c90a98f8a2001752cd9f4ae97365d7543037257c9d8fa",
  "source_response_id": "manual_raw_output__SAMPLE_UCI_POR__A-S02__baseline_first_20_rows",
  "source_response_message_index": null,
  "source_response_provider_id": null,
  "raw_or_source_response_path": "Docs/evaluation_v2/Runs/full_208/phase10_v3_uci_rerun/judge_invocation/raw_outputs/SAMPLE_UCI_POR__A-S02__baseline_first_20_rows.json",
  "raw_or_source_response_sha256": "c0210f1ff4d0ba247a1168b3693ff5c05dbf8737f7d7b377b02473387a8de808",
  "extracted_output_path": "Docs/evaluation_v2/Runs/full_208/phase10_v3_uci_rerun/judge_invocation/extracted_outputs/SAMPLE_UCI_POR__A-S02__baseline_first_20_rows.json",
  "validated_output_path": "Docs/evaluation_v2/Runs/full_208/phase10_v3_uci_rerun/judge_invocation/validated_outputs/SAMPLE_UCI_POR__A-S02__baseline_first_20_rows.json",
  "validated_output_sha256": "c0210f1ff4d0ba247a1168b3693ff5c05dbf8737f7d7b377b02473387a8de808",
  "validation_errors": [],
  "retrieval_log_path_if_applicable": null,
  "judged_at": "2026-06-19T12:41:44.837Z",
  "validated_at": "2026-06-19T12:41:44.837Z"
}
