{
  "schema_version": "execution_attempt_wrapper_schema_v1",
  "evaluation_run_id": "llm_judge_v2_full_208__SAMPLE_UCI_POR",
  "record_id": "SAMPLE_UCI_POR__A-C02__task_aware_data_summarization",
  "session_segment_id": "full_208__SAMPLE_UCI_POR__segment_001",
  "session_sequence_number": 12,
  "attempt_number": 1,
  "attempt_reason": "initial",
  "judge_status": "valid",
  "judge_input_sha256": "08f4ec0a9f20e7a51a1b6b9721235acfe9dcd41b4fbc0ef0e9ffb97ae4192756",
  "source_response_id": "manual_raw_output__SAMPLE_UCI_POR__A-C02__task_aware_data_summarization",
  "source_response_message_index": null,
  "source_response_provider_id": null,
  "raw_or_source_response_path": "Docs/evaluation_v2/Runs/full_208/phase13_taskaware_v3_summary/judge_invocation/SAMPLE_UCI_POR/raw_outputs/SAMPLE_UCI_POR__A-C02__task_aware_data_summarization.json",
  "raw_or_source_response_sha256": "d8f298d3cb3d6c3487937d3e5f3aaffc7b1b44c9a155e1b418681ba9c00cd5d4",
  "extracted_output_path": "Docs/evaluation_v2/Runs/full_208/phase13_taskaware_v3_summary/judge_invocation/SAMPLE_UCI_POR/extracted_outputs/SAMPLE_UCI_POR__A-C02__task_aware_data_summarization.json",
  "validated_output_path": "Docs/evaluation_v2/Runs/full_208/phase13_taskaware_v3_summary/judge_invocation/SAMPLE_UCI_POR/validated_outputs/SAMPLE_UCI_POR__A-C02__task_aware_data_summarization.json",
  "validated_output_sha256": "d8f298d3cb3d6c3487937d3e5f3aaffc7b1b44c9a155e1b418681ba9c00cd5d4",
  "validation_errors": [],
  "retrieval_log_path_if_applicable": null,
  "judged_at": "2026-06-20T17:57:22.820Z",
  "validated_at": "2026-06-20T17:57:22.820Z"
}
