{
 "schema_version": "execution_attempt_wrapper_schema_v1",
 "evaluation_run_id": "oulad_official_r5",
 "record_id": "SAMPLE_OULAD__S-T10__task_aware_data_summarization",
 "session_segment_id": "oulad_official_r5_segment_001",
 "session_sequence_number": 82,
 "attempt_number": 1,
 "attempt_reason": "initial",
 "judge_status": "valid",
 "judge_input_sha256": "3253290be8bad93abf70717334bbd863e96c6a22c1db91f4cf1c6b0b7322fd4c",
 "source_response_id": "manual_raw_output__SAMPLE_OULAD__S-T10__task_aware_data_summarization",
 "source_response_message_index": null,
 "source_response_provider_id": null,
 "raw_or_source_response_path": "Docs/evaluation_v2/Runs/full_208/phase13_local_taskaware/oulad_official_r5/judge_invocation/raw_outputs/SAMPLE_OULAD__S-T10__task_aware_data_summarization.json",
 "raw_or_source_response_sha256": "6bf9314bb21d14d5e8ce56c365c18bb48abb455ba233a9f6766dc5320a847311",
 "extracted_output_path": "Docs/evaluation_v2/Runs/full_208/phase13_local_taskaware/oulad_official_r5/judge_invocation/extracted_outputs/SAMPLE_OULAD__S-T10__task_aware_data_summarization.json",
 "validated_output_path": "Docs/evaluation_v2/Runs/full_208/phase13_local_taskaware/oulad_official_r5/judge_invocation/validated_outputs/SAMPLE_OULAD__S-T10__task_aware_data_summarization.json",
 "validated_output_sha256": "e228e43dd61f1df5380c33082944a93792688d93f0e2fb77462de6a290f52d6b",
 "validation_errors": [],
 "retrieval_log_path_if_applicable": null,
 "judged_at": "2026-06-21T21:15:09.698Z",
 "validated_at": "2026-06-21T21:15:09.698Z"
}
