{
 "schema_version": "execution_attempt_wrapper_schema_v1",
 "evaluation_run_id": "phase13_local_taskaware_official_r4_fresh_judge",
 "record_id": "SAMPLE_UCI_POR__S-T03__task_aware_data_summarization",
 "session_segment_id": "phase13_local_official_r4_fresh_judge_segment_001",
 "session_sequence_number": 36,
 "attempt_number": 1,
 "attempt_reason": "initial",
 "judge_status": "valid",
 "judge_input_sha256": "ab37949ed59d553e95d2cbcda3f7759c9417421e912d787ebca21517670452b8",
 "source_response_id": "manual_raw_output__SAMPLE_UCI_POR__S-T03__task_aware_data_summarization",
 "source_response_message_index": null,
 "source_response_provider_id": null,
 "raw_or_source_response_path": "Docs/evaluation_v2/Runs/full_208/phase13_local_taskaware/official_r4_fresh_judge/judge_invocation/raw_outputs/SAMPLE_UCI_POR__S-T03__task_aware_data_summarization.json",
 "raw_or_source_response_sha256": "7a77c7fc7f137758bbbf681e99a5c03d9221aba51493e64c6c19448df5f2fee5",
 "extracted_output_path": "Docs/evaluation_v2/Runs/full_208/phase13_local_taskaware/official_r4_fresh_judge/judge_invocation/extracted_outputs/SAMPLE_UCI_POR__S-T03__task_aware_data_summarization.json",
 "validated_output_path": "Docs/evaluation_v2/Runs/full_208/phase13_local_taskaware/official_r4_fresh_judge/judge_invocation/validated_outputs/SAMPLE_UCI_POR__S-T03__task_aware_data_summarization.json",
 "validated_output_sha256": "7a77c7fc7f137758bbbf681e99a5c03d9221aba51493e64c6c19448df5f2fee5",
 "validation_errors": [],
 "retrieval_log_path_if_applicable": null,
 "judged_at": "2026-06-21T13:33:48.172Z",
 "validated_at": "2026-06-21T13:33:48.172Z"
}
