{
 "schema_version": "execution_attempt_wrapper_schema_v1",
 "evaluation_run_id": "oulad_official_r5",
 "record_id": "SAMPLE_OULAD__S-B02__baseline_first_20_rows",
 "session_segment_id": "oulad_official_r5_segment_001",
 "session_sequence_number": 63,
 "attempt_number": 1,
 "attempt_reason": "initial",
 "judge_status": "valid",
 "judge_input_sha256": "2f679072d7497ec80a93f0278434fe80ac0575b9e5b41d1f5c8a629e77e735da",
 "source_response_id": "manual_raw_output__SAMPLE_OULAD__S-B02__baseline_first_20_rows",
 "source_response_message_index": null,
 "source_response_provider_id": null,
 "raw_or_source_response_path": "Docs/evaluation_v2/Runs/full_208/phase13_local_taskaware/oulad_official_r5/judge_invocation/raw_outputs/SAMPLE_OULAD__S-B02__baseline_first_20_rows.json",
 "raw_or_source_response_sha256": "c1676564e896f50a00789377bc8906a04acd9fce345c7f8b64cdc60ec88897e1",
 "extracted_output_path": "Docs/evaluation_v2/Runs/full_208/phase13_local_taskaware/oulad_official_r5/judge_invocation/extracted_outputs/SAMPLE_OULAD__S-B02__baseline_first_20_rows.json",
 "validated_output_path": "Docs/evaluation_v2/Runs/full_208/phase13_local_taskaware/oulad_official_r5/judge_invocation/validated_outputs/SAMPLE_OULAD__S-B02__baseline_first_20_rows.json",
 "validated_output_sha256": "80808ad1f7a01fa459975469e10904939cfbc0d14048ba27a46e72cd7c923f70",
 "validation_errors": [],
 "retrieval_log_path_if_applicable": null,
 "judged_at": "2026-06-21T21:15:09.698Z",
 "validated_at": "2026-06-21T21:15:09.698Z"
}
