{
 "schema_version": "execution_attempt_wrapper_schema_v1",
 "evaluation_run_id": "oulad_official_r5",
 "record_id": "SAMPLE_OULAD__A-G02__baseline_first_20_rows",
 "session_segment_id": "oulad_official_r5_segment_001",
 "session_sequence_number": 21,
 "attempt_number": 1,
 "attempt_reason": "initial",
 "judge_status": "valid",
 "judge_input_sha256": "63fefae6e6130e5fbf0ab872d0baacb475328f237ce7a5ea60d18c63780a18f0",
 "source_response_id": "manual_raw_output__SAMPLE_OULAD__A-G02__baseline_first_20_rows",
 "source_response_message_index": null,
 "source_response_provider_id": null,
 "raw_or_source_response_path": "Docs/evaluation_v2/Runs/full_208/phase13_local_taskaware/oulad_official_r5/judge_invocation/raw_outputs/SAMPLE_OULAD__A-G02__baseline_first_20_rows.json",
 "raw_or_source_response_sha256": "090af83cdf173c250b013e7639591be8017262568447eacffce743a867f4568b",
 "extracted_output_path": "Docs/evaluation_v2/Runs/full_208/phase13_local_taskaware/oulad_official_r5/judge_invocation/extracted_outputs/SAMPLE_OULAD__A-G02__baseline_first_20_rows.json",
 "validated_output_path": "Docs/evaluation_v2/Runs/full_208/phase13_local_taskaware/oulad_official_r5/judge_invocation/validated_outputs/SAMPLE_OULAD__A-G02__baseline_first_20_rows.json",
 "validated_output_sha256": "c48fd4bac62bd34b334190bafe8823cc3161af2cd94153e902ebae254c27bfbe",
 "validation_errors": [],
 "retrieval_log_path_if_applicable": "Docs/evaluation_v2/Runs/full_208/phase13_local_taskaware/oulad_official_r5/judge_inputs/retrieval_logs/SAMPLE_OULAD__A-G02__baseline_first_20_rows.json",
 "judged_at": "2026-06-21T21:15:09.698Z",
 "validated_at": "2026-06-21T21:15:09.698Z"
}
